{
	"$schema": "https://json-schema.org/draft/2020-12/schema",
	"title": "默认参数表",
	"description": "除非你知道你在做什么，不然不要改本文件",
	"type": "object",
	"properties": {
		"$schema": {
			"description": "schema文件路径",
			"type": "string",
			"default": "constants.schema.json"
		},
		"3xusername": {
			"description": "3X-UI面板用户名。没必要改，3X-UI面板不会暴露于公网",
			"type": "string",
			"default": "celestia",
			"minLength": 1
		},
		"3xpassword": {
			"description": "3X-UI密码。没必要改，3X-UI面板不会暴露于公网",
			"type": "string",
			"default": "Polaris",
			"minLength": 1
		},
		"initialSshPort": {
			"description": "初始SSH端口",
			"type": "integer",
			"default": 22,
			"minimum": 1,
			"maximum": 65535,
			"not": {
				"enum": [
					80,
					443
				]
			}
		},
		"realityTargetPort": {
			"description": "Reality目标端口",
			"type": "integer",
			"default": 8443,
			"minimum": 1,
			"maximum": 65535,
			"not": {
				"enum": [
					80,
					443
				]
			}
		},
		"fakeSitePort": {
			"description": "Caddy伪装站端口",
			"type": "integer",
			"default": 8085,
			"minimum": 1,
			"maximum": 65535,
			"not": {
				"enum": [
					80,
					443
				]
			}
		},
		"xhttpPort": {
			"description": "Xray XHTTP端口",
			"type": "integer",
			"default": 8087,
			"minimum": 1,
			"maximum": 65535,
			"not": {
				"enum": [
					80,
					443
				]
			}
		},
		"subscriptionPort": {
			"description": "3X-UI订阅内部端口",
			"type": "integer",
			"default": 2054,
			"minimum": 1,
			"maximum": 65535,
			"not": {
				"enum": [
					80,
					443
				]
			}
		},
		"localSshPort": {
			"description": "SSH转发本地端口",
			"type": "integer",
			"default": 2053,
			"minimum": 1,
			"maximum": 65535,
			"not": {
				"enum": [
					80,
					443
				]
			}
		},
		"3xpanelPort": {
			"description": "3X-UI面板端口",
			"type": "integer",
			"default": 2053,
			"minimum": 1,
			"maximum": 65535,
			"not": {
				"enum": [
					80,
					443
				]
			}
		},
		"3xpanelUriPath": {
			"description": "3X-UI面板URI路径（只能含字母和数字，至少5位）",
			"type": "string",
			"default": "3xpanel",
			"minLength": 5,
			"pattern": "^[a-zA-Z0-9]+$"
		},
		"proxyClientsSuffix": {
			"description": "代理客户端下载路径追加字符串",
			"type": "string",
			"default": "p",
			"minLength": 1,
			"pattern": "^[a-zA-Z0-9]+$"
		},
		"dailyTaskHour": {
			"description": "VPS本地时区的每日任务开始小时，任务会在此后随机延迟一小时内执行",
			"type": "integer",
			"default": 4,
			"minimum": 0,
			"maximum": 23
		},
		"subUpdates": {
			"description": "客户端应用中订阅URL的更新间隔（小时）",
			"type": "integer",
			"default": 1,
			"minimum": 1
		},
		"fingerprint": {
			"description": "Reality和XHTTP客户端使用的TLS指纹",
			"type": "string",
			"default": "chrome",
			"minLength": 1
		},
		"proxyClientsFilenames": {
			"description": "代理客户端固定下载文件名",
			"type": "object",
			"properties": {
				"v2rayNWindowsX64": {
					"type": "string",
					"default": "v2rayN-windows-64.zip"
				},
				"v2rayNGAndroidArm64": {
					"type": "string",
					"default": "v2rayNG_latest-fdroid_arm64-v8a.apk"
				},
				"v2rayNMacOSArm64": {
					"type": "string",
					"default": "v2rayN-macos-arm64.dmg"
				},
				"v2rayNLinuxX64Deb": {
					"type": "string",
					"default": "v2rayN-linux-64.deb"
				},
				"v2rayNLinuxX64Rpm": {
					"type": "string",
					"default": "v2rayN-linux-rhel-64.rpm"
				}
			},
			"required": [
				"v2rayNWindowsX64",
				"v2rayNGAndroidArm64",
				"v2rayNMacOSArm64",
				"v2rayNLinuxX64Deb",
				"v2rayNLinuxX64Rpm"
			],
			"additionalProperties": false
		}
	},
	"required": [
		"3xusername",
		"3xpassword",
		"initialSshPort",
		"realityTargetPort",
		"fakeSitePort",
		"xhttpPort",
		"subscriptionPort",
		"proxyClientsSuffix",
		"dailyTaskHour",
		"subUpdates",
		"fingerprint",
		"proxyClientsFilenames",
		"localSshPort",
		"3xpanelPort",
		"3xpanelUriPath"
	],
	"additionalProperties": false
}
